Symbol,Name,Last Sale,Net Change,% Change,Market Cap,Country,IPO Year,Volume,Sector,Industry
WBD,Warner Bros. Discovery Inc. Series A Common Stock ,$14.77,-0.57,-3.716%,35867409142.00,United States,,19334408,Telecommunications,Cable & Other Pay Television Services
WDAY,Workday Inc. Class A Common Stock,$181.47,-2.02,-1.101%,46637790000.00,United States,,1595370,Technology,Computer Software: Prepackaged Software
WDC,Western Digital Corporation Common Stock,$37.06,-0.84,-2.216%,11834290047.00,United States,,2663292,Technology,Electronic Components
WMG,Warner Music Group Corp. Class A Common Stock,$30.04,-0.92,-2.972%,15498803745.00,United States,2020,918599,Consumer Discretionary,Movies/Entertainment
WSC,WillScot Mobile Mini Holdings Corp. Class A Common Stock,$51.28,-1.43,-2.713%,10711869508.00,United States,2015,1755085,Consumer Discretionary,Diversified Commercial Services
WYNN,Wynn Resorts Limited Common stock,$109.63,-3.91,-3.444%,12422568981.00,United States,2002,2850462,Consumer Discretionary,Hotels/Resorts
XEL,Xcel Energy Inc. Common Stock,$64.25,-0.15,-0.233%,35160715868.00,United States,,3239090,Utilities,Power Generation
XM,Qualtrics International Inc. Class A Common Stock,$17.13,-0.11,-0.638%,10172781973.00,United States,2021,4627869,Technology,Computer Software: Prepackaged Software
ZBRA,Zebra Technologies Corporation Class A Common Stock,$296.91,-10.16,-3.309%,15262581947.00,United States,1991,351015,Technology,Computer peripheral equipment
ZM,Zoom Video Communications Inc. Class A Common Stock,$67.62,-1.29,-1.872%,19766829125.00,United States,2019,4015808,Technology,Computer Software: Prepackaged Software
ZS,Zscaler Inc. Common Stock,$110.45,-4.50,-3.915%,15928240472.00,United States,2018,3313755,Technology,EDP Services
