Symbol,Name,Last Sale,Net Change,% Change,Market Cap,Country,IPO Year,Volume,Sector,Industry
TPH,Tri Pointe Homes Inc. Common Stock,$24.18,-0.11,-0.453%,2440099504.00,United States,2013,845611,Consumer Discretionary,Homebuilding
TPR,Tapestry Inc. Common Stock,$41.60,-1.53,-3.547%,9820746374.00,United States,,2739286,Consumer Discretionary,Apparel
TPX,Tempur Sealy International Inc. Common Stock,$40.25,-1.56,-3.731%,6926997590.00,United States,2003,1598794,Consumer Discretionary,Home Furnishings
TR,Tootsie Roll Industries Inc. Common Stock,$42.00,-0.54,-1.269%,2894480946.00,United States,,136343,Consumer Staples,Specialty Foods
TRN,Trinity Industries Inc. Common Stock,$25.81,-0.48,-1.826%,2101020954.00,United States,,310797,Industrials,Railroads
TRNO,Terreno Realty Corporation Common Stock,$61.68,-1.38,-2.188%,5102722993.00,United States,2010,347234,Real Estate,Real Estate Investment Trusts
TROX,Tronox Holdings plc Ordinary Shares (UK),$14.63,-0.84,-5.43%,2260289983.00,United States,,1153749,Industrials,Multi-Sector Companies
UA,Under Armour Inc. Class C Common Stock,$8.17,-0.19,-2.273%,3624118208.00,United States,2016,2712567,Consumer Discretionary,Apparel
UAA,Under Armour Inc. Class A Common Stock,$9.23,-0.26,-2.74%,4094322040.00,United States,,7950890,Consumer Discretionary,Apparel
UGI,UGI Corporation Common Stock,$36.24,-0.52,-1.415%,7594345100.00,United States,,749652,Utilities,Natural Gas Distribution
UHS,Universal Health Services Inc. Common Stock,$119.58,-3.39,-2.757%,8539259459.00,United States,,1002986,Health Care,Hospital/Nursing Management
UNF,Unifirst Corporation Common Stock,$193.41,-0.59,-0.304%,3614564060.00,United States,,54130,Consumer Discretionary,Business Services
UNM,Unum Group Common Stock,$42.48,-1.52,-3.455%,8400632400.00,United States,,1246294,Finance,Accident &Health Insurance
UNVR,Univar Solutions Inc. Common Stock,$32.57,-0.85,-2.543%,5314333003.00,United States,2015,857561,Industrials,Specialty Chemicals
USAC,USA Compression Partners LP Common Units Representing Limited Partner Interests,$21.25,-0.33,-1.529%,2087974829.00,United States,2013,228424,Energy,Oilfield Services/Equipment
USFD,US Foods Holding Corp. Common Stock,$37.27,-1.39,-3.595%,8360423768.00,United States,2016,3099715,Consumer Discretionary,Food Distributors
UTF,Cohen & Steers Infrastructure Fund Inc Common Stock,$23.63,-0.38,-1.583%,2251800765.00,United States,2004,130775,Finance,Finance Companies
VAC,Marriott Vacations Worldwide Corporation Common Stock,$147.81,-6.24,-4.051%,5664100189.00,United States,,310586,Consumer Discretionary,Hotels/Resorts
VFC,V.F. Corporation Common Stock,$23.01,-1.01,-4.205%,8942994072.00,United States,,7345294,Consumer Discretionary,Apparel
VMI,Valmont Industries Inc. Common Stock,$311.89,-6.04,-1.90%,6653567460.00,United States,,133916,Industrials,Construction/Ag Equipment/Trucks
VNO,Vornado Realty Trust Common Stock,$17.88,-0.88,-4.691%,3430579814.00,United States,,3642300,Real Estate,Real Estate Investment Trusts
VOYA,Voya Financial Inc. Common Stock,$72.35,-1.78,-2.401%,7030456783.00,United States,2013,2497076,Finance,Investment Managers
VRT,Vertiv Holdings LLC Class A Common Stock,$15.38,-0.36,-2.287%,5802805497.00,United States,2018,2730128,Consumer Discretionary,Electrical Products
VSH,Vishay Intertechnology Inc. Common Stock,$21.62,-0.14,-0.643%,3062794943.00,United States,,829175,Technology,Industrial Machinery/Components
VVV,Valvoline Inc. Common Stock,$34.77,-0.80,-2.249%,5978199978.00,United States,2016,1372451,Industrials,Automotive Aftermarket
W,Wayfair Inc. Class A Common Stock,$36.23,-2.34,-6.067%,3881029082.00,United States,2014,3528225,Consumer Discretionary,Catalog/Specialty Distribution
WAL,Western Alliance Bancorporation Common Stock (DE),$62.36,-9.20,-12.856%,6791004000.00,United States,2005,4589658,Finance,Major Banks
WBS,Webster Financial Corporation Common Stock,$45.25,-4.05,-8.215%,7873862000.00,United States,,1984603,Finance,Major Banks
WCC,WESCO International Inc. Common Stock,$166.34,-5.92,-3.437%,8457335735.00,United States,1999,427106,Consumer Discretionary,Telecommunications Equipment
WD,Walker & Dunlop Inc Common Stock,$82.37,-3.95,-4.576%,2719205194.00,United States,2010,193737,Finance,Finance: Consumer Services
WEX,WEX Inc. common stock,$185.28,-5.38,-2.822%,8076921786.00,United States,,256667,Technology,EDP Services
WHR,Whirlpool Corporation Common Stock,$134.25,-2.44,-1.785%,7316960222.00,United States,,844326,Consumer Discretionary,Consumer Electronics/Appliances
WK,Workiva Inc. Class A Common Stock,$88.02,-2.64,-2.912%,4625243801.00,United States,2014,443917,Technology,Computer Software: Prepackaged Software
WLYB,John Wiley & Sons Inc. Common Stock,$36.12,-7.02,-16.273%,2006804444.00,United States,,3477,Consumer Discretionary,Books
WMK,Weis Markets Inc. Common Stock,$82.16,0.29,0.354%,2209976077.00,United States,,70882,Consumer Staples,Food Chains
WMS,Advanced Drainage Systems Inc. Common Stock,$89.01,-3.35,-3.627%,7230585735.00,United States,2014,898155,Industrials,Building Products
WOLF,Wolfspeed Inc. Common Stock,$67.43,-2.72,-3.877%,8389417272.00,United States,,2117401,Technology,Semiconductors
WOR,Worthington Industries Inc. Common Stock,$58.11,-2.30,-3.807%,2888511483.00,United States,,191874,Consumer Discretionary,Aerospace
WSM,Williams-Sonoma Inc. Common Stock (DE),$123.80,-0.09,-0.073%,8241048577.00,United States,,1144416,Consumer Discretionary,Other Specialty Stores
WTM,White Mountains Insurance Group Ltd. Common Stock,$1364.87,-32.12,-2.299%,3516221770.00,United States,,11773,Finance,Property-Casualty Insurers
WTS,Watts Water Technologies Inc. Class A Common Stock,$172.21,-3.27,-1.863%,5729937991.00,United States,1986,137266,Industrials,Office Equipment/Supplies/Services
WU,Western Union Company (The) Common Stock,$11.35,-0.44,-3.732%,4239225000.00,United States,,14537774,Consumer Discretionary,Business Services
WWE,World Wrestling Entertainment Inc. Class A Common Stock,$81.00,-0.66,-0.808%,6030136530.00,United States,,985765,Consumer Discretionary,Movies/Entertainment
X,United States Steel Corporation Common Stock,$28.81,-0.79,-2.669%,6528454931.00,United States,,5432505,Industrials,Steel/Iron Ore
XPO,XPO Inc. Common Stock,$35.88,0.58,1.643%,4144247676.00,United States,,3159143,Industrials,Construction/Ag Equipment/Trucks
YELP,Yelp Inc. Common Stock,$29.45,-0.36,-1.208%,2052733000.00,United States,2012,420421,Technology,Internet and Information Services
YETI,YETI Holdings Inc. Common Stock,$37.67,-1.11,-2.862%,3248966228.00,United States,2018,1234265,Consumer Discretionary,Movies/Entertainment
ZWS,Zurn Elkay Water Solutions Corporation Common Stock,$22.30,-0.39,-1.719%,3926364568.00,United States,2012,1181013,Utilities,Environmental Services
