Symbol,Name,Last Sale,Net Change,% Change,Market Cap,Country,IPO Year,Volume,Sector,Industry
AAP,Advance Auto Parts Inc.,$129.83,-2.38,-1.80%,7692909948.00,United States,,1329737,Consumer Discretionary,Auto & Home Supply Stores
AB,AllianceBernstein Holding L.P.  Units,$36.74,-0.81,-2.157%,4181052304.00,United States,,171754,Finance,Investment Managers
ABG,Asbury Automotive Group Inc Common Stock,$234.74,0.04,0.017%,5195513800.00,United States,2002,292323,Consumer Discretionary,Other Specialty Stores
ABM,ABM Industries Incorporated Common Stock,$46.14,-1.36,-2.863%,3049723193.00,United States,,667076,Consumer Discretionary,Diversified Commercial Services
ABR,Arbor Realty Trust Common Stock,$14.11,-0.69,-4.662%,2537241039.00,United States,2004,3755463,Real Estate,Real Estate Investment Trusts
ADC,Agree Realty Corporation Common Stock,$69.40,-0.41,-0.587%,6258035626.00,United States,,737438,Real Estate,Real Estate Investment Trusts
ADT,ADT Inc. Common Stock,$7.63,-0.15,-1.928%,6969755255.00,United States,2018,3229798,Consumer Discretionary,Diversified Commercial Services
AEL,American Equity Investment Life Holding Company Common Stock,$39.19,-1.75,-4.275%,3323713893.00,United States,2003,549955,Finance,Life Insurance
AEO,American Eagle Outfitters Inc. Common Stock,$13.74,-0.32,-2.276%,2574961683.00,United States,,5149167,Consumer Discretionary,Clothing/Shoe/Accessory Stores
AIN,Albany International Corporation Common Stock,$95.91,-0.46,-0.477%,2983845652.00,United States,,142665,Consumer Discretionary,Textiles
AIT,Applied Industrial Technologies Inc. Common Stock,$142.00,0.07,0.049%,5481155554.00,United States,,240530,Industrials,Industrial Machinery/Components
AIZ,Assurant Inc. Common Stock,$119.88,-2.18,-1.786%,6344018551.00,United States,2004,462661,Finance,Specialty Insurers
AJRD,Aerojet Rocketdyne Holdings Inc. Common Stock,$56.01,-0.07,-0.125%,4518732548.00,United States,,672329,Industrials,Military/Government/Technical
AL,Air Lease Corporation Class A Common Stock,$39.72,-1.78,-4.289%,4405449624.00,United States,2011,999102,Consumer Discretionary,Diversified Commercial Services
ALE,Allete Inc.,$61.11,-0.44,-0.715%,3498722519.00,United States,,219125,Utilities,Power Generation
ALG,Alamo Group Inc. Common Stock,$178.24,-3.84,-2.109%,2132859588.00,United States,,54019,Industrials,Industrial Machinery/Components
ALK,Alaska Air Group Inc. Common Stock,$47.52,-1.69,-3.434%,6060809098.00,United States,,1329646,Consumer Discretionary,Air Freight/Delivery Services
ALLE,Allegion plc Ordinary Shares,$111.50,-2.85,-2.492%,9794697653.00,United States,2013,898714,Consumer Discretionary,Diversified Commercial Services
ALLY,Ally Financial Inc. Common Stock,$27.38,-2.06,-6.997%,8195491120.00,United States,2014,8590654,Finance,Diversified Financial Services
ALSN,Allison Transmission Holdings Inc. Common Stock,$47.29,-0.83,-1.725%,4344265395.00,United States,2012,1143603,Consumer Discretionary,Auto Parts:O.E.M.
AM,Antero Midstream Corporation Common Stock,$10.34,-0.04,-0.385%,4948862411.00,United States,2017,2672362,Utilities,Natural Gas Distribution
AMG,Affiliated Managers Group Inc. Common Stock,$152.24,-5.25,-3.334%,5459293364.00,United States,,265631,Finance,Investment Managers
AMK,AssetMark Financial Holdings Inc. Common Stock,$29.94,-1.31,-4.192%,2210982354.00,United States,2019,96568,Finance,Finance/Investors Services
AMN,AMN Healthcare Services Inc AMN Healthcare Services Inc,$89.83,1.36,1.537%,3892864885.00,United States,,1078471,Health Care,Assisted Living Services
AMR,Alpha Metallurgical Resources Inc. Common Stock,$174.35,-4.20,-2.352%,2711609061.00,United States,2018,276406,Energy,Coal Mining
AMRC,Ameresco Inc. Class A Common Stock,$44.51,-1.19,-2.604%,2310700730.00,United States,2010,334630,Industrials,Water Sewer Pipeline Comm & Power Line Construction
AN,AutoNation Inc. Common Stock,$141.03,-1.50,-1.052%,6613840050.00,United States,,861505,Consumer Discretionary,Other Specialty Stores
APAM,Artisan Partners Asset Management Inc. Class A Common Stock,$31.44,-0.57,-1.781%,2135123632.00,United States,2013,537039,Finance,Investment Managers
APLE,Apple Hospitality REIT Inc. Common Shares,$15.79,-0.79,-4.765%,3612003712.00,United States,2015,1387184,Real Estate,Real Estate Investment Trusts
AQUA,Evoqua Water Technologies Corp. Common Stock,$47.83,-0.37,-0.768%,5844163794.00,United States,2017,1675768,Industrials,Office Equipment/Supplies/Services
ARCH,Arch Resources Inc. Class A Common Stock,$154.53,-1.98,-1.265%,2705887366.00,United States,2016,658184,Energy,Coal Mining
ARW,Arrow Electronics Inc. Common Stock,$117.01,-1.98,-1.664%,6819843720.00,United States,,353607,Technology,Electronic Components
ASB,Associated Banc-Corp Common Stock,$20.58,-1.39,-6.327%,3098152220.00,United States,,2008053,Finance,Major Banks
ASGN,ASGN Incorporated Common Stock,$85.06,-1.62,-1.869%,4244494000.00,United States,1992,152234,Technology,EDP Services
ASH,Ashland Inc. Common Stock,$99.83,-1.03,-1.021%,5417932530.00,United States,,355568,Industrials,Specialty Chemicals
ATI,ATI Inc. Common Stock,$40.41,-1.56,-3.717%,5229767802.00,United States,,1117444,Industrials,Steel/Iron Ore
ATKR,Atkore Inc. Common Stock,$146.07,-3.54,-2.366%,5770451967.00,United States,2016,354705,Technology,Electrical Products
ATR,AptarGroup Inc. Common Stock,$114.57,-0.76,-0.659%,7492926463.00,United States,,189712,Health Care,Medical/Dental Instruments
AUB,Atlantic Union Bankshares Corporation Common Stock,$36.36,-2.28,-5.901%,2716550936.00,United States,,1189178,Finance,Major Banks
AVA,Avista Corporation Common Stock,$41.10,-0.23,-0.556%,3032183736.00,United States,,409003,Utilities,Power Generation
AVNT,Avient Corporation Common Stock,$40.94,-1.21,-2.871%,3723228159.00,United States,,373595,Industrials,Major Chemicals
AWR,American States Water Company Common Stock,$85.78,-0.68,-0.786%,3170505745.00,United States,,128156,Utilities,Water Supply
AX,Axos Financial Inc. Common Stock,$40.94,-4.75,-10.396%,2456429026.00,United States,2018,649007,Finance,Savings Institutions
AXTA,Axalta Coating Systems Ltd. Common Shares,$30.03,-1.03,-3.316%,6638192101.00,United States,2014,2986626,Consumer Discretionary,Paints/Coatings
AYI,Acuity Brands Inc. ,$198.07,-2.01,-1.005%,6348437238.00,United States,,259535,Consumer Discretionary,Building Products
AYX,Alteryx Inc. Class A Common Stock,$60.92,-4.38,-6.708%,4235391114.00,United States,2017,1911260,Technology,Computer Software: Prepackaged Software
B,Barnes Group Inc. Common Stock,$40.18,-0.68,-1.664%,2031855951.00,United States,,241074,Industrials,Office Equipment/Supplies/Services
BBLN,Babylon Holdings Limited Class A Ordinary Shares,$9.91,0.79,8.662%,6145517475.00,United States,,163929,Health Care,Medical/Nursing Services
BC,Brunswick Corporation Common Stock,$85.39,-3.00,-3.394%,6075650409.00,United States,,431220,Consumer Discretionary,Homebuilding
BCO,Brinks Company (The) Common Stock,$66.58,-1.25,-1.843%,3092614767.00,United States,,194533,Technology,Security Systems Services
BDC,Belden Inc Common Stock,$85.36,-0.81,-0.94%,3653889857.00,United States,,187474,Telecommunications,Telecommunications Equipment
BERY,Berry Global Group Inc. Common Stock,$59.26,-1.26,-2.082%,7194164000.00,United States,2012,1020815,Industrials,Plastic Products
BFAM,Bright Horizons Family Solutions Inc. Common Stock,$81.73,-1.88,-2.249%,4719908889.00,United States,2013,475529,Consumer Discretionary,Other Consumer Services
BKH,Black Hills Corporation Common Stock,$60.99,-0.36,-0.587%,4031651123.00,United States,,324769,Utilities,Electric Utilities: Central
BKU,BankUnited Inc. Common Stock,$30.42,-2.69,-8.124%,2302020937.00,United States,2011,1191428,Finance,Savings Institutions
BLD,TopBuild Corp. Common Stock,$200.03,-3.05,-1.502%,6395425570.00,United States,2015,238707,Industrials,Engineering & Construction
BMI,Badger Meter Inc. Common Stock,$118.50,-0.58,-0.487%,3468394157.00,United States,1971,81304,Industrials,Industrial Machinery/Components
BNL,Broadstone Net Lease Inc. Common Stock,$17.29,-0.12,-0.689%,3217927468.00,United States,2020,599407,Real Estate,Real Estate Investment Trusts
BOH,Bank of Hawaii Corporation Common Stock,$67.53,-5.39,-7.392%,2690108198.00,United States,,477030,Finance,Major Banks
BOOT,Boot Barn Holdings Inc. Common Stock,$75.63,-2.87,-3.656%,2254914047.00,United States,2014,662847,Consumer Discretionary,Clothing/Shoe/Accessory Stores
BOWL,Bowlero Corp. Class A Common Stock,$16.59,-0.53,-3.096%,2747916121.00,United States,2021,2686740,Consumer Discretionary,Movies/Entertainment
BOX,Box Inc. Class A Common Stock,$26.03,-1.00,-3.70%,3720072478.00,United States,2015,2616978,Technology,Computer Software: Prepackaged Software
BRBR,BellRing Brands Inc. Common Stock ,$30.30,-0.53,-1.719%,4047274929.00,United States,2022,444714,Consumer Staples,Beverages (Production/Distribution)
BRC,Brady Corporation Common Stock,$53.82,-0.64,-1.175%,2676972893.00,United States,,160890,Technology,Security Systems Services
BSM,Black Stone Minerals L.P. Common units representing limited partner interests,$14.83,-0.16,-1.067%,3105504727.00,United States,2015,610407,Energy,Oil & Gas Production
BTU,Peabody Energy Corporation Common Stock ,$25.69,-0.33,-1.268%,3696791000.00,United States,2017,2918541,Energy,Coal Mining
BXMT,Blackstone Mortgage Trust Inc. Common Stock,$19.64,-0.52,-2.579%,3383660078.00,United States,,2928201,Real Estate,Real Estate Investment Trusts
BXP,Boston Properties Inc. Common Stock,$61.94,-2.23,-3.475%,9709582282.00,United States,1997,1572055,Real Estate,Real Estate Investment Trusts
BYD,Boyd Gaming Corporation Common Stock,$63.06,-1.81,-2.79%,6581892797.00,United States,1993,1236762,Consumer Discretionary,Movies/Entertainment
CABO,Cable One Inc. Common Stock,$655.64,-18.05,-2.679%,3808883539.00,United States,2015,56180,Consumer Discretionary,Telecommunications Equipment
CACI,CACI International Inc. Class A Common Stock,$284.66,-4.03,-1.396%,6691821155.00,United States,,146204,Technology,EDP Services
CADE,Cadence Bank Common Stock,$24.40,-1.59,-6.118%,4451651266.00,United States,,2120405,Finance,Major Banks
CALX,Calix Inc Common Stock,$49.51,-1.42,-2.788%,3239998169.00,United States,2010,452347,Technology,Computer Software: Prepackaged Software
CBT,Cabot Corporation Common Stock,$76.63,-2.66,-3.355%,4316074096.00,United States,,257661,Industrials,Specialty Chemicals
CBU,Community Bank System Inc. Common Stock,$54.33,-2.51,-4.416%,2919531210.00,United States,,353302,Finance,Major Banks
CBZ,CBIZ Inc. Common Stock,$48.63,-0.63,-1.279%,2440253400.00,United States,,245447,Consumer Discretionary,Business Services
CC,Chemours Company (The) Common Stock,$32.72,-1.41,-4.131%,4853548488.00,United States,2015,910552,Industrials,Industrial Specialties
CEQP,Crestwood Equity Partners LP,$25.36,-0.11,-0.432%,2653984331.00,United States,,457504,Energy,Oilfield Services/Equipment
CFR,Cullen/Frost Bankers Inc. Common Stock,$120.05,-6.49,-5.129%,7726455576.00,United States,,610634,Finance,Major Banks
CHE,Chemed Corp,$506.80,-2.08,-0.409%,7536270574.00,United States,,54263,Health Care,Medical/Nursing Services
CHH,Choice Hotels International Inc. Common Stock,$118.35,-3.47,-2.848%,6307960675.00,United States,,291773,Consumer Discretionary,Hotels/Resorts
CIEN,Ciena Corporation Common Stock,$49.64,-1.38,-2.705%,7404182668.00,United States,1997,1562876,Utilities,Telecommunications Equipment
CIVI,Civitas Resources Inc. Common Stock,$70.24,-2.34,-3.224%,5978182522.00,United States,2017,836483,Energy,Oil & Gas Production
CMA,Comerica Incorporated Common Stock,$61.91,-5.39,-8.009%,8132059401.00,United States,,4048805,Finance,Major Banks
CMC,Commercial Metals Company Common Stock,$50.56,-1.79,-3.419%,5921722044.00,United States,,885143,Industrials,Steel/Iron Ore
CNMD,CONMED Corporation Common Stock,$96.13,-0.03,-0.031%,2930274266.00,United States,1987,244825,Health Care,Biotechnology: Electromedical & Electrotherapeutic Apparatus
CNO,CNO Financial Group Inc. Common Stock,$23.64,-1.06,-4.291%,2703070175.00,United States,,710625,Finance,Life Insurance
CNS,Cohen & Steers Inc Common Stock,$68.21,-2.75,-3.875%,3322259451.00,United States,2004,134064,Finance,Investment Managers
CNX,CNX Resources Corporation Common Stock,$15.31,-0.56,-3.529%,2604637144.00,United States,1999,3386710,Energy,Oil & Gas Production
COHR,Coherent Corp. Common Stock,$39.99,-1.48,-3.569%,5557116813.00,United States,,1438010,Industrials,Industrial Machinery/Components
COLD,Americold Realty Trust Inc. Common Stock,$29.14,-0.55,-1.852%,7862407818.00,United States,2018,887836,Real Estate,Real Estate Investment Trusts
COTY,Coty Inc. Class A Common Stock,$11.02,-0.30,-2.65%,9395605947.00,United States,2013,4707794,Consumer Discretionary,Package Goods/Cosmetics
CPE,Callon Petroleum Company Common Stock,$37.22,-1.53,-3.948%,2293069152.00,United States,,1069851,Energy,Oil & Gas Production
CPK,Chesapeake Utilities Corporation Common Stock,$124.73,-1.93,-1.524%,2212839171.00,United States,,82176,Utilities,Oil & Gas Production
CR,Crane Holdings Co. Common Stock,$117.50,-1.96,-1.641%,6596970173.00,United States,,274038,Industrials,Office Equipment/Supplies/Services
CRI,Carter's Inc. Common Stock,$71.80,-1.45,-1.98%,2740002162.00,United States,2003,535743,Consumer Discretionary,Department/Specialty Retail Stores
CRK,Comstock Resources Inc. Common Stock,$11.56,-0.40,-3.344%,3208017507.00,United States,,3817342,Energy,Oil & Gas Production
CRS,Carpenter Technology Corporation Common Stock,$47.28,-1.58,-3.234%,2293515402.00,United States,,286966,Industrials,Steel/Iron Ore
CUZ,Cousins Properties Incorporated Common Stock,$23.82,-0.81,-3.289%,3609477900.00,United States,,1515006,Real Estate,Real Estate Investment Trusts
CVI,CVR Energy Inc. Common Stock,$31.13,-0.94,-2.931%,3129517547.00,United States,2007,675825,Energy,Integrated oil Companies
CWEN,Clearway Energy Inc. Class C Common Stock,$30.53,-0.66,-2.116%,3566038271.00,United States,2015,464604,Utilities,Electric Utilities: Central
CWT,California Water Service Group Common Stock,$55.62,-0.72,-1.278%,3049310880.00,United States,,184609,Utilities,Water Supply
DAN,Dana Incorporated Common Stock ,$15.11,-0.80,-5.028%,2166070856.00,United States,,1731141,Consumer Discretionary,Auto Parts:O.E.M.
DAR,Darling Ingredients Inc. Common Stock,$61.25,-0.81,-1.305%,9816624353.00,United States,1997,1075997,Consumer Staples,Farming/Seeds/Milling
DCI,Donaldson Company Inc. Common Stock,$65.42,-0.58,-0.879%,7960758306.00,United States,,337060,Industrials,Pollution Control Equipment
DCP,DCP Midstream  LP Common Units ,$41.72,-0.02,-0.048%,8700732367.00,United States,,1628680,Utilities,Natural Gas Distribution
DDS,Dillard's Inc. Common Stock,$340.13,-15.37,-4.323%,5824696999.00,United States,,163782,Consumer Discretionary,Department/Specialty Retail Stores
DEI,Douglas Emmett Inc. Common Stock,$13.34,-0.58,-4.167%,2345301158.00,United States,2006,2591523,Real Estate,Real Estate Investment Trusts
DKL,Delek Logistics Partners L.P. Common Units representing Limited Partner Interests,$51.10,0.06,0.118%,2222450347.00,United States,2012,47983,Energy,Oil & Gas Production
DLB,Dolby Laboratories Common Stock,$81.64,-1.09,-1.318%,7822897957.00,United States,2005,301063,Technology,EDP Services
DNA,Ginkgo Bioworks Holdings Inc. Class A Common Stock,$1.25,-0.07,-5.303%,2566799533.00,United States,2021,18522931,Health Care,Biotechnology: Biological Products (No Diagnostic Substances)
DNB,Dun & Bradstreet Holdings Inc. Common Stock,$11.66,-0.33,-2.752%,5080466365.00,United States,2020,1643376,Technology,Internet and Information Services
DNP,DNP Select Income Fund Inc. Common Stock,$11.27,-0.09,-0.792%,3999214351.00,United States,1987,406556,Finance,Investment Managers
DOC,Physicians Realty Trust Common Shares of Beneficial Interest,$14.74,-0.22,-1.471%,3364565076.00,United States,2013,1689428,Real Estate,Real Estate Investment Trusts
DOCN,DigitalOcean Holdings Inc. Common Stock,$34.55,-2.25,-6.114%,3342108117.00,United States,2021,2156498,Technology,Retail: Computer Software & Peripheral Equipment
DVA,DaVita Inc. Common Stock,$74.87,-4.51,-5.682%,6745787000.00,United States,,971756,Health Care,Medical/Nursing Services
DY,Dycom Industries Inc. Common Stock,$102.37,-1.69,-1.624%,3025715182.00,United States,,473589,Industrials,Water Sewer Pipeline Comm & Power Line Construction
EGP,EastGroup Properties Inc. Common Stock,$162.17,-3.43,-2.071%,7063208940.00,United States,,242657,Real Estate,Real Estate Investment Trusts
EHC,Encompass Health Corporation Common Stock,$54.05,-0.43,-0.789%,5393566533.00,United States,,2149716,Health Care,Medical Specialities
ELAN,Elanco Animal Health Incorporated Common Stock,$10.11,-0.53,-4.981%,4794216897.00,United States,2018,6135384,Health Care,Biotechnology: Pharmaceutical Preparations
ELF,e.l.f. Beauty Inc. Common Stock,$71.13,-2.88,-3.891%,3790852153.00,United States,2016,1309319,Consumer Discretionary,Package Goods/Cosmetics
EME,EMCOR Group Inc. Common Stock,$164.89,-3.08,-1.834%,7857874337.00,United States,,216790,Industrials,Engineering & Construction
EMN,Eastman Chemical Company Common Stock,$82.60,-1.89,-2.237%,9812621214.00,United States,,853098,Industrials,Major Chemicals
ENOV,Enovis Corporation Common Stock,$55.32,-1.19,-2.106%,2995560242.00,United States,,355802,Industrials,Fluid Controls
ENR,Energizer Holdings Inc. Common Stock,$34.39,-0.54,-1.546%,2456372914.00,United States,2015,431963,Industrials,Metal Fabrications
ENS,EnerSys Common Stock,$86.92,-1.98,-2.227%,3550727459.00,United States,2004,193886,Consumer Discretionary,Telecommunications Equipment
ENV,Envestnet Inc Common Stock,$58.90,-1.49,-2.467%,3258709410.00,United States,2010,417801,Technology,EDP Services
EPR,EPR Properties Common Stock,$39.11,-1.28,-3.169%,2934073305.00,United States,1997,472690,Real Estate,Real Estate Investment Trusts
EPRT,Essential Properties Realty Trust Inc. Common Stock,$25.22,-0.19,-0.748%,3640529320.00,United States,2018,579249,Real Estate,Real Estate Investment Trusts
EQC,Equity Commonwealth Common Shares of Beneficial Interest,$19.96,-0.23,-1.139%,2186838478.00,United States,,1260453,Real Estate,Real Estate Investment Trusts
ESE,ESCO Technologies Inc. Common Stock,$91.07,-1.49,-1.61%,2357395035.00,United States,,77041,Telecommunications,Telecommunications Equipment
ESI,Element Solutions Inc. Common Stock,$19.85,-0.67,-3.265%,4805398207.00,United States,2014,899015,Industrials,Industrial Specialties
ESTC,Elastic N.V. Ordinary Shares,$56.26,-3.75,-6.249%,5378756485.00,United States,2018,1322251,Technology,Computer Software: Prepackaged Software
EVH,Evolent Health Inc Class A Common Stock,$32.77,-1.55,-4.516%,3329775921.00,United States,2015,588275,Health Care,Managed Health Care
EVR,Evercore Inc. Class A Common Stock,$125.27,-3.93,-3.042%,4865201435.00,United States,2006,401583,Finance,Investment Managers
EXG,Eaton Vance Tax-Managed Global Diversified Equity Income Fund Eaton Vance Tax-Managed Global Diversified Equity Income Fund Common Shares of Beneficial Interest,$7.53,-0.10,-1.311%,2306334792.00,United States,2007,865285,Finance,Finance Companies
EXP,Eagle Materials Inc Common Stock,$140.50,-4.20,-2.903%,5065344497.00,United States,,171919,Industrials,Building Materials
FAF,First American Corporation (New) Common Stock,$53.79,-0.35,-0.646%,5547542036.00,United States,,707673,Finance,Specialty Insurers
FCN,FTI Consulting Inc. Common Stock,$179.94,-0.74,-0.41%,6194094413.00,United States,1999,192052,Consumer Discretionary,Professional Services
FCPT,Four Corners Property Trust Inc. Common Stock,$26.81,-0.21,-0.777%,2308035902.00,United States,2015,306313,Real Estate,Real Estate Investment Trusts
FHI,Federated Hermes Inc. Common Stock,$38.81,-1.09,-2.732%,3453898550.00,United States,,902189,Finance,Investment Managers
FIX,Comfort Systems USA Inc. Common Stock,$145.00,-3.82,-2.567%,5185318320.00,United States,1997,220397,Industrials,Engineering & Construction
FL,Foot Locker Inc.,$44.06,-0.26,-0.587%,4111698014.00,United States,,3140111,Consumer Discretionary,Clothing/Shoe/Accessory Stores
FLO,Flowers Foods Inc. Common Stock,$27.32,-0.10,-0.365%,5768156674.00,United States,,1392264,Consumer Staples,Farming/Seeds/Milling
FLR,Fluor Corporation Common Stock,$34.51,-1.21,-3.387%,4903467682.00,United States,,1892955,Industrials,Oilfield Services/Equipment
FLS,Flowserve Corporation Common Stock,$33.39,-0.60,-1.765%,4363934966.00,United States,,735969,Industrials,Fluid Controls
FNB,F.N.B. Corporation Common Stock,$12.90,-0.67,-4.937%,4650064419.00,United States,,2774803,Finance,Major Banks
FNF,FNF Group of Fidelity National Financial Inc. Common Stock,$36.42,-0.70,-1.886%,9911049152.00,United States,2014,1411605,Finance,Specialty Insurers
FOUR,Shift4 Payments Inc. Class A Common Stock,$68.45,-2.63,-3.70%,3876537406.00,United States,2020,1560328,Technology,EDP Services
FR,First Industrial Realty Trust Inc. Common Stock,$52.63,-0.88,-1.645%,6958284245.00,United States,1994,1104881,Real Estate,Real Estate Investment Trusts
FRT,Federal Realty Investment Trust Common Stock,$102.41,-2.54,-2.42%,8331379164.00,United States,,449041,Real Estate,Real Estate Investment Trusts
FSS,Federal Signal Corporation Common Stock,$54.75,-0.57,-1.03%,3319851605.00,United States,,342781,Technology,Industrial Machinery/Components
FUL,H. B. Fuller Company Common Stock,$68.37,-1.52,-2.175%,3672000098.00,United States,,276767,Industrials,Home Furnishings
FUN,Cedar Fair L.P. Common Stock,$46.66,-0.34,-0.723%,2423084129.00,United States,1987,227840,Consumer Discretionary,Movies/Entertainment
GATX,GATX Corporation Common Stock,$104.22,-2.67,-2.498%,3678966000.00,United States,,161513,Consumer Discretionary,Rental/Leasing Companies
GBCI,Glacier Bancorp Inc. Common Stock,$41.61,-3.19,-7.121%,4609463426.00,United States,,770369,Finance,Major Banks
GFF,Griffon Corporation Common Stock,$35.60,-1.08,-2.944%,2035829503.00,United States,,544207,Industrials,Consumer Electronics/Appliances
GHC,Graham Holdings Company Common Stock,$607.18,-14.62,-2.351%,2915462204.00,United States,,16762,Consumer Discretionary,Service to the Health Industry
GKOS,Glaukos Corporation Common Stock,$46.58,-1.04,-2.184%,2222018596.00,United States,2015,293096,Health Care,Biotechnology: Electromedical & Electrotherapeutic Apparatus
GME,GameStop Corporation Common Stock,$17.52,-0.65,-3.577%,5336207786.00,United States,2002,2643357,Consumer Discretionary,Electronics Distribution
GMED,Globus Medical Inc. Class A Common Stock,$54.92,-1.70,-3.002%,5507821463.00,United States,2012,2193697,Health Care,Medical/Dental Instruments
GNRC,Generac Holdlings Inc. Common Stock,$117.80,-3.65,-3.005%,7234913765.00,United States,2010,822092,Consumer Discretionary,Metal Fabrications
GNW,Genworth Financial Inc Common Stock,$5.92,-0.21,-3.426%,2932768000.00,United States,2004,4849227,Finance,Life Insurance
GOLF,Acushnet Holdings Corp. Common Stock,$50.31,-0.39,-0.769%,3532216098.00,United States,2016,218651,Consumer Discretionary,Recreational Games/Products/Toys
GPI,Group 1 Automotive Inc. Common Stock,$226.62,-0.44,-0.194%,3219676229.00,United States,1997,158445,Consumer Discretionary,Other Specialty Stores
GPK,Graphic Packaging Holding Company,$24.62,-0.32,-1.283%,7561346890.00,United States,,2301997,Basic Materials,Paper
GPS,Gap Inc. (The) Common Stock,$11.58,-0.38,-3.177%,4227261885.00,United States,,19898910,Consumer Discretionary,Clothing/Shoe/Accessory Stores
GTLS,Chart Industries Inc. Common Stock,$143.98,-6.02,-4.013%,6127508471.00,United States,2006,683207,Technology,Electrical Products
GWRE,Guidewire Software Inc. Common Stock,$73.07,-3.32,-4.346%,5982693715.00,United States,2012,1669903,Technology,Computer Software: Prepackaged Software
HAE,Haemonetics Corporation Common Stock,$77.01,-1.50,-1.911%,3884963669.00,United States,1991,317970,Health Care,Medical/Dental Instruments
HASI,Hannon Armstrong Sustainable Infrastructure Capital Inc. Common Stock,$29.23,-0.77,-2.567%,2655165744.00,United States,2013,414359,Real Estate,Real Estate Investment Trusts
HAYW,Hayward Holdings Inc. Common Stock,$11.76,-0.28,-2.326%,2484612322.00,United States,2021,1464969,Technology,Electronic Components
HE,Hawaiian Electric Industries Inc. Common Stock,$39.09,-0.34,-0.862%,4279199461.00,United States,,444476,Utilities,Power Generation
HHC,Howard Hughes Corporation (The) Common Stock,$78.74,-3.23,-3.94%,3929194661.00,United States,,151251,Real Estate,Building operators
HI,Hillenbrand Inc Common Stock,$47.17,-0.41,-0.862%,3273454415.00,United States,,237325,Consumer Discretionary,Consumer Specialties
HII,Huntington Ingalls Industries Inc. Common Stock,$210.01,-2.34,-1.102%,8370119498.00,United States,,333534,Industrials,Metal Fabrications
HIW,Highwoods Properties Inc. Common Stock,$25.21,-1.00,-3.815%,2652365730.00,United States,1994,1916310,Real Estate,Real Estate Investment Trusts
HL,Hecla Mining Company Common Stock,$5.13,0.00,0.00%,3118127265.00,United States,,6121843,Basic Materials,Precious Metals
HLI,Houlihan Lokey Inc. Class A Common Stock,$90.12,-2.58,-2.783%,6184154800.00,United States,2015,388523,Finance,Investment Managers
HLIO,Helios Technologies Inc. Common Stock,$68.56,-1.04,-1.494%,2232071995.00,United States,2021,83097,Industrials,Fluid Controls
HOG,Harley-Davidson Inc. Common Stock,$41.31,-2.17,-4.991%,6038861618.00,United States,,2798899,Consumer Discretionary,Motor Vehicles
HOMB,Home BancShares Inc. Common Stock,$21.92,-1.20,-5.19%,4459273280.00,United States,2006,1341181,Finance,Major Banks
HP,Helmerich & Payne Inc. Common Stock,$40.23,-2.51,-5.873%,4202612347.00,United States,,1798645,Energy,Oil & Gas Production
HR,Healthcare Realty Trust Incorporated Common Stock,$19.00,-0.18,-0.938%,7230873510.00,United States,,3969124,Real Estate,Real Estate Investment Trusts
